{
  "schema": "audioprep.manifest.v1",
  "manifest_version": 1,
  "job_id": "job_01J5R2EXAMPLE",
  "created_at": "2026-08-09T05:00:00Z",
  "source": {
    "artifact_id": "art_source_01",
    "content_hash": "sha256:aaaaaaaaaaaaaaaaaaaaaaaaaaaaaaaaaaaaaaaaaaaaaaaaaaaaaaaaaaaaaaaa",
    "size_bytes": 2880044,
    "mtime_ns": 1786251600000000000,
    "path_basename": "meeting.wav"
  },
  "segments": [
    {
      "segment_id": "seg_000001",
      "ordinal": 0,
      "wav": "segments/seg_000001.wav",
      "artifact_id": "art_segment_01",
      "blob_hash": "sha256:bbbbbbbbbbbbbbbbbbbbbbbbbbbbbbbbbbbbbbbbbbbbbbbbbbbbbbbbbbbbbbbb",
      "format": {
        "container": "wav",
        "sample_rate_hz": 16000,
        "channels": 1,
        "sample_format": "s16le"
      },
      "src_start_ms": 1200,
      "src_end_ms": 4200,
      "mapping_kind": "IDENTITY_SLICE",
      "timebase": {
        "src": {"num": 1, "den": 16000},
        "dst": {"num": 1, "den": 16000}
      },
      "dst_end_tick": 48000,
      "time_map_ticks": [
        {"op": "MAP", "src": [19200, 67200], "dst": [0, 48000]}
      ],
      "speaker": "spk_01",
      "quality_flags": []
    }
  ]
}
